understanding how to relate two equations to solve for one variable,understanding ratios between two equations,Test 3,N,Question 6,2,Solving Equation/Expression,6,Heart of Algebra,Solving Systems of Linear Equations,C,,,,,,
Fraction multiplied by Variable = Fraction,"Solving equation, involving fraction",Test 3,N,Question 7,2,Solving Equation/Expression,7,Heart of Algebra,Solving Linear Equations,D,,,,,,
understanding how to relate two equations to solve for one variable,understanding ratios between two equations,Test 3,N,Question 9,2,Solving Equation/Expression,9,Heart of Algebra,Solving Systems of Linear Equations,A,,,,,,
Manipulating an equation to isolate variables,be able to move variables and numbers across equations,Test 3,W,Question 13,2,Solving Equation/Expression,13,Passport to Advanced Math,Quadratic and Exponential Word Problems,D,,,,,,
Being able to solve for a range of points within an linear inequality,know how to set inequalities equal to eachother and generate a range of possible points,Test 3,W,Question 36,2,Solving Equation/Expression,36,Heart of Algebra,Systems of Linear Inequalities Word Problems,750,,,,,,
Finding the expression that is equal,understanding relationships within fractions,Test 4,N,Question 6,2,Solving Equation/Expression,6,Passport to Advanced Math,Structure in Expressions,B,,,,,,
Finding a range of solutions from an equation,Understanding range and how to find it,Test 4,N,Question 9,2,Solving Equation/Expression,9,Passport to Advanced Math,Radical and Rational Equations,D,,,,,,
solving for variables in a fraction,understand relationships within fractions,Test 4,N,Question 10,2,Solving Equation/Expression,10,Passport to Advanced Math,Radical and Rational Equations,D,,,,,,
Solve for possible solutions in an equation,know how to factor and interpret the factoring,Test 4,N,Question 18,2,Solving Equation/Expression,18,Passport to Advanced Math,Solving Quadratic Equations,5,,,,,,
Drawing a line on a graph given a word problem,Creating slope given a word problem and applying it to a graph,Test 4,W,Question 20,2,Solving Equation/Expression,20,Problem Solving and Data Analysis,Key Features of Graphs,C,,,,,,
Being able to relate equations to determine variables real world examples,creating equations and then relating them to find a variable,Test 1,W,Question 19,2,Word Problem,19,Heart of Algebra,Systems of Linear Equations Word Problems,B,,,,,,
creating an equation given a word problem,concept of tax and discounts and how that relates to an equation,Test 1,W,Question 20,2,Word Problem,20,Problem Solving and Data Analysis,Linear and Exponential Growth,D,,,,,,
Number or times something occurs in an interval,simple division,Test 1,W,Question 34,2,Word Problem,34,Problem Solving and Data Analysis,Percents,96,,,,,,
Understanding shaps and relationships between sides/angles given an equation,Interpreting equations,Test 2,N,Question 8,2,Word Problem,8,Heart of Algebra,Linear Inequality Word Problems,C,,,,,,
coming up with an equation to solve a word problem,Being able to look at a table and find rates. connect data to make a line/slope,Test 2,W,Question 11,2,Word Problem,11,Problem Solving and Data Analysis,"Ratios, rates, proportions",B,,,,,,
converting word Problem to Inequaltiy ,converting senario to inequaltiy ,Test 2,W,Question 12,2,Word Problem,12,Heart of Algebra,Linear Inequality Word Problems,D,,,,,,
Statistical analysis,Understanding the difference between sample population and other statistical variables,Test 2,W,Question 13,2,Word Problem,13,Problem Solving and Data Analysis,"Center, Spread, and Shape of Distributions",D,,,,,,
Figuring out MPH from a word problem,"Know days in a year, how to fine rate given time distance an interval",Test 2,W,Question 15,2,Word Problem,15,Problem Solving and Data Analysis,"Ratios, rates, proportions",A,,,,,,
Finding a number based on a % decrease,How to calculate the number you get from a % decrease,Test 2,W,Question 17,2,Word Problem,17,Problem Solving and Data Analysis,Percents,C,,,,,,
Interpreting a survey,Understanding surveys and statistical tests,Test 2,W,Question 18,2,Word Problem,18,Problem Solving and Data Analysis,"Center, Spread, and Shape of Distributions",C,,,,,,
Creating equations and then relating them to solve for one variable,creating equations and then relating them to find a variable,Test 2,W,Question 34,2,Word Problem,34,Heart of Algebra,Systems of Linear Equations Word Problems,105,,,,,,
Interpreting parts of an equation given real world scenarios,recognzing how slope applies to real world scenarios,Test 2,W,Question 35,2,Word Problem,35,Heart of Algebra,Linear Function Word Problems,15,,,,,,
"Given equation of line, point on line, solve for slope ",Equation of Line (y=mx+B),Test 3,N,Question 8,2,Word Problem,8,Heart of Algebra,Graphing Linear Equation Word Problems,A,,,,,,
relating variables through equations given word problems,finding equations through word problems,Test 3,N,Question 19,2,Word Problem,19,Heart of Algebra,Systems of Linear Equations Word Problems,370,,,,,,
Creating a formula of a line given a discriptipion,"understanding properties of a line (slope, Intercept)",Test 3,W,Question 14,2,Word Problem,14,Heart of Algebra,Linear Function Word Problems,A,,,,,,
Making conclusions given a description of a test,Understanding surveys and statistical tests,Test 3,W,Question 15,2,Word Problem,15,Problem Solving and Data Analysis,Data Collection and Conclusions,A,,,,,,
Manipulate an equation and see its effect on another,Know how to change and  set equations equal and solve,Test 3,W,Question 17,2,Word Problem,17,Passport to Advanced Math,Quadratic and Exponential Word Problems,B,,,,,,
Being able to set lines equal to eachother to find a point,Know how to set lines equal to eachother,Test 3,W,Question 18,2,Word Problem,18,Heart of Algebra,Systems of Linear Equations Word Problems,B,,,,,,
Look at a word problem to create an equation to come up with an answer,Recognize rates within a problem,Test 3,W,Question 19,2,Word Problem,19,Problem Solving and Data Analysis,"Ratios, rates, proportions",C,,,,,,
Determining mean,Understanding how mean is calculated,Test 3,W,Question 35,2,Word Problem,35,Problem Solving and Data Analysis,"Center, Spread, and Shape of Distributions",50,,,,,,
Being able to recognize information as points on a graph,how to fill in variables and rate given a word problem (slope),Test 4,N,Question 7,2,Word Problem,7,Heart of Algebra,Linear Equation Word Problems,D,,,,,,
Finding the Future value of an investment,Know how to work a FV equation,Test 4,W,Question 14,2,Word Problem,14,Problem Solving and Data Analysis,Linear and Exponential Growth,D,,,,,,
using volume to solve for a word problem,understand volume and the difference between different measurements,Test 4,W,Question 18,2,Word Problem,18,Additional Topics in Math,Volume Word Problems,C,,,,,,
"one inequality, use solution to say least possible value of expression","solving for one variable, inequality",Test 4,W,Question 19,2,Word Problem,19,Heart of Algebra,Solving Linear Inequalities,A,,,,,,
Convert units given more challenging relationships,"Understand units and how to convert them, can interpret unit rations in a word problem",Test 4,W,Question 33,2,Word Problem,33,Problem Solving and Data Analysis,Units,4.55,,,,,,
Understanding fractions and how to create them in word problems,Fractions,Test 4,W,Question 34,2,Word Problem,34,Heart of Algebra,Systems of Linear Equations Word Problems,150,,,,,,
Come up with a proportion of a population given a table,Interpret a table. understang proportions and percentages ,Test 1,W,Question 21,3,Charts,21,Problem Solving and Data Analysis,Table Data,C,,,,,,
Finding mean,Being able to interpret a table,Test 1,W,Question 22,3,Charts,22,Problem Solving and Data Analysis,Data Collection and Conclusions,B,,,,,,
Finding rations within a table,Being able to interpret a table,Test 1,W,Question 23,3,Charts,23,Problem Solving and Data Analysis,Data Collection and Conclusions,B,,,,,,
Make inferences based of a table and data,understand how to find average based on table,Test 1,W,Question 27,3,Charts,27,Problem Solving and Data Analysis,Table Data,C,,,,,,
Solving for proportions based on a table,working a table to find proportions and relationships between the data,Test 2,W,Question 20,3,Charts,20,Problem Solving and Data Analysis,Table Data,C,,,,,,
Figuring out a decrease over time,How to apply changes in percentage,Test 4,W,Question 22,3,Charts,22,Problem Solving and Data Analysis,"Ratios, rates, proportions",B,,,,,,
Interpreting a table,Standard deviation,Test 4,W,Question 23,3,Charts,23,Problem Solving and Data Analysis,Data Inferences,B,,,,,,
Explain parts of an equation,Know how an equation changes the properties of a line,Test 4,W,Question 27,3,Charts,27,Problem Solving and Data Analysis,Scatterplots,D,,,,,,
Finding the cos and sin of an angle,Interpreting cos and sine in a problem,Test 1,N,Question 19,3,Geometry,19,Additional Topics in Math,Angles Arc Lengths and Trig Functions,0.6,,,,,,
Solving for an equation for velovity as it relates to time,Being able to interpret a word problem to then plug in answers,Test 1,W,Question 24,3,Geometry,25,Additional Topics in Math,Circle Equations,A,,,,,,
using radians to solve word problems,understand what are and how to use radians,Test 2,N,Question 19,3,Geometry,19,Additional Topics in Math,Circle Equations,6,,,,,,
Using properties of a hexagon to solve for an adjacent square,Know how side lengths affect area.  use propeeties of one shape to solve for another,Test 2,W,Question 30,3,Geometry,30,Additional Topics in Math,Right Triangle Geometry,,,,,,,
finding relationships between angels given a discription,Congruency and determining angles of the same size given a description,Test 3,N,Question 11,3,Geometry,11,Additional Topics in Math,Angles Arc Lengths and Trig Functions,B,,,,,,
usisng descriptions of sides to solve for a value,"using sin, cos, verticies",Test 3,N,Question 20,3,Geometry,20,Additional Topics in Math,Right Triangle Word Problems,0.6,,,,,,
Finding value of a varibale in equations surrounding angles,Know relationship between Sin(a) and Cos(b) ,Test 3,W,Question 23,3,Geometry,23,Additional Topics in Math,Angles Arc Lengths and Trig Functions,C,,,,,,
Putting together two shapes to find volume,understanding volume and area,Test 3,W,Question 25,3,Geometry,25,Additional Topics in Math,Volume Word Problems,D,,,,,,
"Determining coordinates, given information about a line",Slope formula ,Test 3,W,Question 26,3,Geometry,26,Heart of Algebra,Graphing Linear Equation Word Problems,C,,,,,,
Finding a percent decrease,Be able to relate Length and Width,Test 3,W,Question 27,3,Geometry,27,Problem Solving and Data Analysis,"Ratios, rates, proportions",C,,,,,,
Using properties of a circle to solve for Diameter,"Diameter, arc length and properties of circle to make decision",Test 4,W,Question 24,3,Geometry,24,Additional Topics in Math,Angles Arc Lengths and Trig Functions,C,,,,,,
Finding the length of an angle given possible arc length,understand how arc length relates to angles in the shape.,Test 4,W,Question 36,3,Geometry,36,Additional Topics in Math,Angles Arc Lengths and Trig Functions,"29, 30, 31,32,33,34",,,,,,
Being able to read and graph Inequalities,Slope and the concept of quadrants ,Test 1,W,Question 28,3,Graphs,28,Heart of Algebra,Graphing Linear Equations,C,,,,,,
Determining factors,Understand the concept of a factor,Test 1,W,Question 29,3,Graphs,29,Passport to Advanced Math,Function Notation,D,,,,,,
Recognizing factors given graph of line,understanding how factors work,Test 1,W,Question 30,3,Graphs,30,Passport to Advanced Math,Nonlinear Equation Graphs,D,,,,,,
Determining slope given relationship ,"Knowing Slope, Quadrants",Test 2,W,Question 25,3,Graphs,25,Heart of Algebra,Graphing Linear Equation Word Problems,A,,,,,,
Understanding a graph,Understanding how points on a graph reflect Y and X inputs,Test 2,W,Question 26,3,Graphs,26,Passport to Advanced Math,Nonlinear Equation Graphs,D,,,,,,
Constructing perpendicular line,"Relating Diagonals of a Square, Perpendicular lines",Test 2,W,Question 28,3,Graphs,28,Heart of Algebra,Graphing Linear Equation Word Problems,B,,,,,,
Solve for a coordinate given an equation,Know terms such as vertex and how that relates to an equation,Test 3,N,Question 12,3,Graphs,12,Passport to Advanced Math,Solving Quadratic Equations,A,,,,,,
Applying an equation to a graph,Be able to find intercepts given the equation(s) of a line,Test 4,N,Question 13,3,Graphs,13,Passport to Advanced Math,Nonlinear Equation Graphs,B,,,,,,
Relating a histogram to a scatter plot,knowing how to graph data on a scatter plot vs histogram,Test 4,W,Question 21,3,Graphs,21,Problem Solving and Data Analysis,Scatterplots,C,,,,,,
How does a graph relate to an equation,How an equation relates to a graph an intepreting constants,Test 4,W,Question 30,3,Graphs,30,Passport to Advanced Math,Polynomial Factors and Graphs,D,,,,,,
Equating two seperate equations,manipulate equation to find similarities,Test 1,N,Question 13,3,Solving Equation/Expression,13,Passport to Advanced Math,Radical and Rational Equations,B,,,,,,
Solving for variables in a fraction,understand relationships within fractions,Test 1,N,Question 14,3,Solving Equation/Expression,14,Passport to Advanced Math,Radicals and Rational Exponents,A,,,,,,
Solving for variables in an equation,Understand how toe Foil and how numbers change final equation,Test 1,N,Question 15,3,Solving Equation/Expression,15,Passport to Advanced Math,Solving Quadratic Equations,D,,,,,,
Solving for X given two seperate equations,Understanding relationship between to equations,Test 1,N,Question 20,3,Solving Equation/Expression,20,Passport to Advanced Math,Radical and Rational Equations,100,,,,,,
Understanding impact on Mean Median and Mode,What are the Mean Median Mode and how do they work,Test 1,W,Question 25,3,Solving Equation/Expression,24,Passport to Advanced Math,Manipulating Quadratic and Exponential Expressions,D,,,,,,
Finding an equivalent expression,understanding how to manipulte fractions and irrational numbers,Test 2,N,Question 11,3,Solving Equation/Expression,11,Additional Topics in Math,Complex Numbers,C,,,,,,
Manipulating an equation to isolate variables,how to move variables across sides of an equation,Test 2,N,Question 12,3,Solving Equation/Expression,12,Passport to Advanced Math,Isolating Quantities,B,,,,,,
Solve for a variable in an equation,Can move around variables.  Can deal with moving powers/square roots,Test 2,N,Question 13,3,Solving Equation/Expression,13,Passport to Advanced Math,Solving Quadratic Equations,D,,,,,,
Finding the expression that is equal,know how to manipulate equations,Test 2,N,Question 15,3,Solving Equation/Expression,15,Passport to Advanced Math,Structure in Expressions,D,,,,,,
Being able to relate equations to determine variables,understanding how to relate vairables in an equation,Test 2,N,Question 20,3,Solving Equation/Expression,20,Heart of Algebra,Solving Systems of Linear Equations,0.25,,,,,,
Manipulate and equation ,Be able to move around variables within an equation ,Test 2,W,Question 22,3,Solving Equation/Expression,22,Passport to Advanced Math,Structure in Expressions,B,,,,,,
Solving for radius of a circle given the shapes equation,being able to relate the equation to radius,Test 2,W,Question 24,3,Solving Equation/Expression,24,Additional Topics in Math,Circle Equations,,,,,,,
Finding two constants in an equation,being able to tell what values satisfies a systems of equations,Test 2,W,Question 29,3,Solving Equation/Expression,29,Passport to Advanced Math,Linear and Quadratic Systems,B,,,,,,
plugging in variables to an equation,Feel comfortable worling with less straight forward equations and plugging in variables,Test 2,W,Question 37,3,Solving Equation/Expression,37,Problem Solving and Data Analysis,Units,3284,,,,,,
Manipulating equations to isolate variables,be able to move variables and numbers across equations,Test 3,N,Question 13,3,Solving Equation/Expression,13,Passport to Advanced Math,Operations with Rational Expressions,B,,,,,,
Solve for possible solutions in an equation,know how to factor and interpret the factoring,Test 3,N,Question 14,3,Solving Equation/Expression,14,Passport to Advanced Math,Solving Quadratic Equations,A,,,,,,
determining values given descriptions of variables,How to create linear equation given three variables and their relationship,Test 3,W,Question 22,3,Solving Equation/Expression,22,Heart of Algebra,Linear Equation Word Problems,B,,,,,,
Being able to solve for relationships between multiple variables in an equation,understanding how to relate vairables in an equation,Test 3,W,Question 30,3,Solving Equation/Expression,30,Heart of Algebra,Solving Systems of Linear Equations,A,,,,,,
How many ordered pair satisfy and equation,being able to tell what values satisfies a systems of equations,Test 4,N,Question 11,3,Solving Equation/Expression,11,Passport to Advanced Math,Linear and Quadratic Systems,C,,,,,,
condensing two parts of a fraction,be able to condense fractions,Test 4,N,Question 14,3,Solving Equation/Expression,14,Additional Topics in Math,Complex Numbers,A,,,,,,
Find the variable given an equation and constants,Know how to deal with constants,Test 4,N,Question 15,3,Solving Equation/Expression,15,Passport to Advanced Math,Structure in Expressions,B,,,,,,
Being able to plug in coordinates to solve equations,"Know the (x,y) format  Relate equations",Test 4,N,Question 19,3,Solving Equation/Expression,19,Heart of Algebra,Solving Systems of Linear Equations,0,,,,,,
What function satisfies the factor,how to divide through factors,Test 4,W,Question 25,3,Solving Equation/Expression,25,Passport to Advanced Math,Function Notation,B,,,,,,
"given a condition relating two valiables, what must be true ",understanding inequalities,Test 4,W,Question 26,3,Solving Equation/Expression,26,Heart of Algebra,Solving Linear Inequalities,C,,,,,,
Expanding factors into a larger function,how to do FOIL,Test 4,W,Question 28,3,Solving Equation/Expression,28,Passport to Advanced Math,Function Notation,D,,,,,,
Determining Average of several expressions,Understanding averages,Test 4,W,Question 29,3,Solving Equation/Expression,29,Heart of Algebra,Solving Linear Equations,B,,,,,,
Finding a number based on a % increase,How to calculate the number you get from a % increase,Test 1,W,Question 26,3,Word Problem,26,Problem Solving and Data Analysis,Percents,B,,,,,,
Determining part of an equation,What do variables represent in word problems,Test 1,W,Question 37,3,Word Problem,37,Passport to Advanced Math,Manipulating Quadratic and Exponential Expressions,1.02,,,,,,
Plugging numbers into an equation,Understanding parts of an equation given a word problem,Test 1,W,Question 38,3,Word Problem,38,Passport to Advanced Math,Quadratic and Exponential Word Problems,6.11,,,,,,
Creating an equation given a word problem,Understanding rate and applying to exponential equations,Test 2,N,Question 14,3,Word Problem,14,Passport to Advanced Math,Quadratic and Exponential Word Problems,A,,,,,,
Convering Word problem involving time into inequality,converting senario to inequaltiy ,Test 2,W,Question 21,3,Word Problem,21,Heart of Algebra,Linear Inequality Word Problems,D,,,,,,
Solving for a relationship between two variables,being able to input the correct variables given a description,Test 2,W,Question 23,3,Word Problem,23,Passport to Advanced Math,Interpreting Nonlinear Expressions,A,,,,,,
Comparing data from a test,Being able to compare and contrast two seperate lines of data,Test 2,W,Question 27,3,Word Problem,27,Problem Solving and Data Analysis,Scatterplots,D,,,,,,
"plugging in variables to an equation,  Also manipulate the equation",Feel comfortable worling with less straight forward equations and plugging in variables,Test 2,W,Question 38,3,Word Problem,38,Problem Solving and Data Analysis,Units,7500,,,,,,
Understanding how an equation works in order to determine if a description is true or false,Understanding relationships within the equation,Test 3,N,Question 15,3,Word Problem,15,Heart of Algebra,Interpreting Linear Functions,D,,,,,,
Determining the growth,Understanding how exponential growth works,Test 3,W,Question 21,3,Word Problem,21,Problem Solving and Data Analysis,Data Collection and Conclusions,C,,,,,,
Solving word Problems,how to fill in variables and rate given a word problem,Test 3,W,Question 24,3,Word Problem,24,Heart of Algebra,Linear Equation Word Problems,D,,,,,,
Creating a equations given a word problem,know how to assign variables from a word problem into an equation,Test 3,W,Question 28,3,Word Problem,28,Passport to Advanced Math,Manipulating Quadratic and Exponential Expressions,D,,,,,,
interpreting a description to fill out a table,understanding ratios to then use to fill out a table,Test 3,W,Question 29,3,Word Problem,29,Problem Solving and Data Analysis,Table Data,A,,,,,,
,,Test 3,W,Question 37,3,Word Problem,37,Problem Solving and Data Analysis,"Ratios, rates, proportions",7,,,,,,
,,Test 3,W,Question 38,3,Word Problem,38,Problem Solving and Data Analysis,"Ratios, rates, proportions",60,,,,,,
Creating a formula of a line given a discriptipion,"understanding properties of a line (slope, Intercept) in real world scenarios",Test 4,N,Question 12,3,Word Problem,12,Heart of Algebra,Linear Function Word Problems,C,,,,,,
Creating a formula of a line given a discriptipion,Being able to recognize points and when to find slope,Test 4,N,Question 20,3,Word Problem,20,Heart of Algebra,Linear Function Word Problems,25,,,,,,
Creating a ratio based on a word problem,,Test 4,W,Question 35,3,Word Problem,35,Passport to Advanced Math,Quadratic and Exponential Word Problems,2.25,,,,,,
Solving for a variable given a word problem,Understand percentages and time value of money,Test 4,W,Question 37,3,Word Problem,37,Passport to Advanced Math,Quadratic and Exponential Word Problems,0.72,,,,,,
Solving for a variable given a word problem,Understand percentages and time value of money,Test 4,W,Question 38,3,Word Problem,38,Passport to Advanced Math,Quadratic and Exponential Word Problems,134,,,,,,